[
  {
    "orderType": "PRODUCTION",
    "type": "RED",
    "timestamp": "2025-10-01T11:36:10.096Z",
    "orderId": "06dbdb8a-311e-4cf0-b76d-1366317cbccc",
    "productionSteps": [
      {
        "id": "f18b9cbe-cfa4-414c-bfa5-547af27ef169",
        "type": "NAVIGATION",
        "state": "FINISHED",
        "source": "START",
        "target": "HBW",
        "startedAt": "2025-10-01T11:38:08.965Z",
        "stoppedAt": "2025-10-01T11:38:20.722Z"
      },
      {
        "id": "15ff7822-b9c8-46cd-9935-649ea2be427b",
        "type": "MANUFACTURE",
        "dependentActionId": "f18b9cbe-cfa4-414c-bfa5-547af27ef169",
        "state": "FINISHED",
        "command": "DROP",
        "moduleType": "HBW",
        "startedAt": "2025-10-01T11:38:20.727Z",
        "serialNumber": "SVR3QA0022",
        "stoppedAt": "2025-10-01T11:39:07.226Z"
      },
      {
        "id": "d3889a3d-9590-4d6f-a2ea-9961a5ac990c",
        "type": "NAVIGATION",
        "state": "FINISHED",
        "source": "HBW",
        "target": "MILL",
        "dependentActionId": "15ff7822-b9c8-46cd-9935-649ea2be427b",
        "startedAt": "2025-10-01T11:39:07.398Z",
        "stoppedAt": "2025-10-01T11:39:16.786Z"
      },
      {
        "id": "52b705c8-e7b9-4ab1-9571-7c9808ecca23",
        "type": "MANUFACTURE",
        "dependentActionId": "d3889a3d-9590-4d6f-a2ea-9961a5ac990c",
        "state": "FINISHED",
        "command": "PICK",
        "moduleType": "MILL",
        "startedAt": "2025-10-01T11:39:16.791Z",
        "serialNumber": "SVR3QA2098",
        "stoppedAt": "2025-10-01T11:39:26.680Z"
      },
      {
        "id": "0ce88144-07b3-4129-b707-cba1e6178c6e",
        "type": "MANUFACTURE",
        "dependentActionId": "52b705c8-e7b9-4ab1-9571-7c9808ecca23",
        "state": "FINISHED",
        "command": "MILL",
        "moduleType": "MILL",
        "startedAt": "2025-10-01T11:39:26.685Z",
        "serialNumber": "SVR3QA2098",
        "stoppedAt": "2025-10-01T11:39:35.831Z"
      },
      {
        "id": "9f7e1a84-c552-4410-b9f1-eca51854f5e9",
        "type": "MANUFACTURE",
        "dependentActionId": "0ce88144-07b3-4129-b707-cba1e6178c6e",
        "state": "FINISHED",
        "command": "DROP",
        "moduleType": "MILL",
        "startedAt": "2025-10-01T11:39:35.846Z",
        "serialNumber": "SVR3QA2098",
        "stoppedAt": "2025-10-01T11:39:45.783Z"
      },
      {
        "id": "6959a2c7-ecbb-40de-8884-3ca03484ccc6",
        "type": "NAVIGATION",
        "state": "FINISHED",
        "source": "MILL",
        "target": "AIQS",
        "dependentActionId": "9f7e1a84-c552-4410-b9f1-eca51854f5e9",
        "startedAt": "2025-10-01T11:39:45.927Z",
        "stoppedAt": "2025-10-01T11:39:59.089Z"
      },
      {
        "id": "3b2f383f-5615-4c8b-a2bd-842ccb5e738b",
        "type": "MANUFACTURE",
        "dependentActionId": "6959a2c7-ecbb-40de-8884-3ca03484ccc6",
        "state": "FINISHED",
        "command": "PICK",
        "moduleType": "AIQS",
        "startedAt": "2025-10-01T11:39:59.094Z",
        "serialNumber": "SVR4H76530",
        "stoppedAt": "2025-10-01T11:40:07.052Z"
      },
      {
        "id": "f86efb7f-1d8f-4e39-92f5-e3e46b72ece6",
        "type": "MANUFACTURE",
        "dependentActionId": "3b2f383f-5615-4c8b-a2bd-842ccb5e738b",
        "state": "FINISHED",
        "command": "CHECK_QUALITY",
        "moduleType": "AIQS",
        "startedAt": "2025-10-01T11:40:07.055Z",
        "serialNumber": "SVR4H76530",
        "stoppedAt": "2025-10-01T11:40:16.027Z"
      },
      {
        "id": "41f3bac8-b302-4bfe-82a3-3be9c7be203b",
        "type": "MANUFACTURE",
        "dependentActionId": "f86efb7f-1d8f-4e39-92f5-e3e46b72ece6",
        "state": "FINISHED",
        "command": "DROP",
        "moduleType": "AIQS",
        "startedAt": "2025-10-01T11:40:16.036Z",
        "serialNumber": "SVR4H76530",
        "stoppedAt": "2025-10-01T11:40:24.915Z"
      },
      {
        "id": "b3450351-fe35-4f98-a9be-ad9ff28dc1fb",
        "type": "NAVIGATION",
        "state": "ENQUEUED",
        "source": "AIQS",
        "target": "DPS",
        "dependentActionId": "41f3bac8-b302-4bfe-82a3-3be9c7be203b"
      },
      {
        "id": "d7f1dff7-526a-41da-a1c1-a5aab8f26f47",
        "type": "MANUFACTURE",
        "dependentActionId": "b3450351-fe35-4f98-a9be-ad9ff28dc1fb",
        "state": "ENQUEUED",
        "command": "PICK",
        "moduleType": "DPS"
      }
    ],
    "receivedAt": "2025-10-01T11:38:08.924Z",
    "state": "IN_PROGRESS",
    "workpieceId": "040a8dca341291",
    "startedAt": "2025-10-01T11:38:08.924Z"
  }
]