[
  {
    "orderType": "STORAGE",
    "type": "WHITE",
    "timestamp": "2025-10-01T09:53:51.969Z",
    "orderId": "5e0cc980-785a-44fc-a690-3e3ac2eaabd3",
    "productionSteps": [
      {
        "id": "ce016d78-4598-4752-bbf6-f1cc69d1f311",
        "type": "NAVIGATION",
        "state": "IN_PROGRESS",
        "source": "START",
        "target": "DPS",
        "startedAt": "2025-10-01T09:53:52.055Z"
      },
      {
        "id": "04cad677-4488-4db7-8e8c-b7f770c41dd5",
        "type": "MANUFACTURE",
        "dependentActionId": "ce016d78-4598-4752-bbf6-f1cc69d1f311",
        "state": "ENQUEUED",
        "command": "DROP",
        "moduleType": "DPS"
      },
      {
        "id": "5eb0ae0b-3f88-4b40-b7c7-f82f79b7484a",
        "type": "NAVIGATION",
        "state": "ENQUEUED",
        "source": "DPS",
        "target": "HBW",
        "dependentActionId": "04cad677-4488-4db7-8e8c-b7f770c41dd5"
      },
      {
        "id": "25a0f241-c8b1-4c67-bc1a-24e45107b08d",
        "type": "MANUFACTURE",
        "dependentActionId": "5eb0ae0b-3f88-4b40-b7c7-f82f79b7484a",
        "state": "ENQUEUED",
        "command": "PICK",
        "moduleType": "HBW"
      }
    ],
    "receivedAt": "2025-10-01T09:53:52.031Z",
    "state": "IN_PROGRESS",
    "workpieceId": "047b8bca341291",
    "startedAt": "2025-10-01T09:53:52.032Z"
  }
]