[
  {
    "orderType": "STORAGE",
    "type": "BLUE",
    "timestamp": "2025-10-01T10:06:20.280Z",
    "orderId": "8b54cc26-e37b-4428-887e-35da7fb574fd",
    "productionSteps": [
      {
        "id": "59ada0e9-8003-4d1a-bd32-130a7160e924",
        "type": "NAVIGATION",
        "state": "FINISHED",
        "source": "START",
        "target": "DPS",
        "startedAt": "2025-10-01T10:06:20.415Z",
        "stoppedAt": "2025-10-01T10:06:22.428Z"
      },
      {
        "id": "789b7014-836d-44d2-b17b-2d661222c96b",
        "type": "MANUFACTURE",
        "dependentActionId": "59ada0e9-8003-4d1a-bd32-130a7160e924",
        "state": "FINISHED",
        "command": "DROP",
        "moduleType": "DPS",
        "startedAt": "2025-10-01T10:06:22.431Z",
        "serialNumber": "SVR4H73275",
        "stoppedAt": "2025-10-01T10:06:36.537Z"
      },
      {
        "id": "ecbe41ce-f742-4b96-9f32-672e92dff01e",
        "type": "NAVIGATION",
        "state": "FINISHED",
        "source": "DPS",
        "target": "HBW",
        "dependentActionId": "789b7014-836d-44d2-b17b-2d661222c96b",
        "startedAt": "2025-10-01T10:06:36.882Z",
        "stoppedAt": "2025-10-01T10:06:46.751Z"
      },
      {
        "id": "bce1f53c-065c-4dd9-ad87-e2ac6cbc265d",
        "type": "MANUFACTURE",
        "dependentActionId": "ecbe41ce-f742-4b96-9f32-672e92dff01e",
        "state": "IN_PROGRESS",
        "command": "PICK",
        "moduleType": "HBW",
        "startedAt": "2025-10-01T10:06:46.758Z",
        "serialNumber": "SVR3QA0022"
      }
    ],
    "receivedAt": "2025-10-01T10:06:20.387Z",
    "state": "IN_PROGRESS",
    "workpieceId": "047389ca341291",
    "startedAt": "2025-10-01T10:06:20.388Z"
  }
]