[
  {
    "orderType": "PRODUCTION",
    "type": "WHITE",
    "timestamp": "2025-10-01T09:38:37.420Z",
    "orderId": "d41940cc-356f-4c98-8352-d57c039b9b8e",
    "productionSteps": [
      {
        "id": "045c08f2-dc8a-4bfc-923c-6aaacd60237a",
        "type": "NAVIGATION",
        "state": "FINISHED",
        "source": "START",
        "target": "HBW",
        "startedAt": "2025-10-01T09:38:37.531Z",
        "stoppedAt": "2025-10-01T09:38:39.575Z"
      },
      {
        "id": "7828b789-d790-4d49-97dd-d5c076975561",
        "type": "MANUFACTURE",
        "dependentActionId": "045c08f2-dc8a-4bfc-923c-6aaacd60237a",
        "state": "FINISHED",
        "command": "DROP",
        "moduleType": "HBW",
        "startedAt": "2025-10-01T09:38:39.577Z",
        "serialNumber": "SVR3QA0022",
        "stoppedAt": "2025-10-01T09:39:20.402Z"
      },
      {
        "id": "80d11088-e361-4617-b04f-d946e900f313",
        "type": "NAVIGATION",
        "state": "FINISHED",
        "source": "HBW",
        "target": "DRILL",
        "dependentActionId": "7828b789-d790-4d49-97dd-d5c076975561",
        "startedAt": "2025-10-01T09:39:20.503Z",
        "stoppedAt": "2025-10-01T09:39:33.898Z"
      },
      {
        "id": "001a13d9-b0bf-4c74-9703-8c0ed6c18930",
        "type": "MANUFACTURE",
        "dependentActionId": "80d11088-e361-4617-b04f-d946e900f313",
        "state": "FINISHED",
        "command": "PICK",
        "moduleType": "DRILL",
        "startedAt": "2025-10-01T09:39:33.901Z",
        "serialNumber": "SVR4H76449",
        "stoppedAt": "2025-10-01T09:39:44.958Z"
      },
      {
        "id": "5106ad8a-34a4-4e12-adb4-83004e0c03fc",
        "type": "MANUFACTURE",
        "dependentActionId": "001a13d9-b0bf-4c74-9703-8c0ed6c18930",
        "state": "FINISHED",
        "command": "DRILL",
        "moduleType": "DRILL",
        "startedAt": "2025-10-01T09:39:44.960Z",
        "serialNumber": "SVR4H76449",
        "stoppedAt": "2025-10-01T09:39:53.910Z"
      },
      {
        "id": "5c85ed99-f941-4f51-82e6-faab236ff899",
        "type": "MANUFACTURE",
        "dependentActionId": "5106ad8a-34a4-4e12-adb4-83004e0c03fc",
        "state": "FINISHED",
        "command": "DROP",
        "moduleType": "DRILL",
        "startedAt": "2025-10-01T09:39:53.922Z",
        "serialNumber": "SVR4H76449",
        "stoppedAt": "2025-10-01T09:40:04.865Z"
      },
      {
        "id": "06d04f01-df74-4fda-a77b-2718c9dd9947",
        "type": "NAVIGATION",
        "state": "FINISHED",
        "source": "DRILL",
        "target": "AIQS",
        "dependentActionId": "5c85ed99-f941-4f51-82e6-faab236ff899",
        "startedAt": "2025-10-01T09:40:05.014Z",
        "stoppedAt": "2025-10-01T09:40:23.100Z"
      },
      {
        "id": "71d1a4a5-b745-4bb1-a912-5ec45d1da862",
        "type": "MANUFACTURE",
        "dependentActionId": "06d04f01-df74-4fda-a77b-2718c9dd9947",
        "state": "FINISHED",
        "command": "PICK",
        "moduleType": "AIQS",
        "startedAt": "2025-10-01T09:40:23.106Z",
        "serialNumber": "SVR4H76530",
        "stoppedAt": "2025-10-01T09:40:31.386Z"
      },
      {
        "id": "de12ed6f-ee6c-4b41-9427-ed568ee4f793",
        "type": "MANUFACTURE",
        "dependentActionId": "71d1a4a5-b745-4bb1-a912-5ec45d1da862",
        "state": "FINISHED",
        "command": "CHECK_QUALITY",
        "moduleType": "AIQS",
        "startedAt": "2025-10-01T09:40:31.390Z",
        "serialNumber": "SVR4H76530",
        "stoppedAt": "2025-10-01T09:40:39.326Z"
      },
      {
        "id": "bb23112b-b2e3-4f88-aadf-1010c8a0cfa3",
        "type": "MANUFACTURE",
        "dependentActionId": "de12ed6f-ee6c-4b41-9427-ed568ee4f793",
        "state": "FINISHED",
        "command": "DROP",
        "moduleType": "AIQS",
        "startedAt": "2025-10-01T09:40:39.342Z",
        "serialNumber": "SVR4H76530",
        "stoppedAt": "2025-10-01T09:40:48.445Z"
      },
      {
        "id": "53eff382-aa9b-4b76-8223-b41761e93a35",
        "type": "NAVIGATION",
        "state": "FINISHED",
        "source": "AIQS",
        "target": "DPS",
        "dependentActionId": "bb23112b-b2e3-4f88-aadf-1010c8a0cfa3",
        "startedAt": "2025-10-01T09:40:48.618Z",
        "stoppedAt": "2025-10-01T09:40:57.960Z"
      },
      {
        "id": "63a451a9-f6d2-4008-869e-0e588469e1f2",
        "type": "MANUFACTURE",
        "dependentActionId": "53eff382-aa9b-4b76-8223-b41761e93a35",
        "state": "IN_PROGRESS",
        "command": "PICK",
        "moduleType": "DPS",
        "startedAt": "2025-10-01T09:40:57.967Z",
        "serialNumber": "SVR4H73275"
      }
    ],
    "receivedAt": "2025-10-01T09:38:37.496Z",
    "state": "IN_PROGRESS",
    "workpieceId": "047b8bca341291",
    "startedAt": "2025-10-01T09:38:37.496Z"
  }
]