[
  {
    "orderType": "PRODUCTION",
    "type": "RED",
    "timestamp": "2025-10-01T10:12:18.633Z",
    "orderId": "0f77cfd1-c4ec-4e5f-8262-d9de2add939a",
    "productionSteps": [
      {
        "id": "245d9d53-aa2c-4e57-940f-0a0e9078e747",
        "type": "NAVIGATION",
        "state": "IN_PROGRESS",
        "source": "START",
        "target": "HBW",
        "startedAt": "2025-10-01T10:12:18.734Z"
      },
      {
        "id": "261b0b0e-2e36-496c-b023-6f7c3742565b",
        "type": "MANUFACTURE",
        "dependentActionId": "245d9d53-aa2c-4e57-940f-0a0e9078e747",
        "state": "ENQUEUED",
        "command": "DROP",
        "moduleType": "HBW"
      },
      {
        "id": "22efe65d-caab-4cbf-98a6-0965eda5b2ad",
        "type": "NAVIGATION",
        "state": "ENQUEUED",
        "source": "HBW",
        "target": "MILL",
        "dependentActionId": "261b0b0e-2e36-496c-b023-6f7c3742565b"
      },
      {
        "id": "58aefacb-3bf6-4fa1-828d-11bd5a2efbfe",
        "type": "MANUFACTURE",
        "dependentActionId": "22efe65d-caab-4cbf-98a6-0965eda5b2ad",
        "state": "ENQUEUED",
        "command": "PICK",
        "moduleType": "MILL"
      },
      {
        "id": "789ebf8e-6006-4b0f-8483-aa76a5c0b03f",
        "type": "MANUFACTURE",
        "dependentActionId": "58aefacb-3bf6-4fa1-828d-11bd5a2efbfe",
        "state": "ENQUEUED",
        "command": "MILL",
        "moduleType": "MILL"
      },
      {
        "id": "6aaa9fc6-8e13-4535-b514-23aa71e75e31",
        "type": "MANUFACTURE",
        "dependentActionId": "789ebf8e-6006-4b0f-8483-aa76a5c0b03f",
        "state": "ENQUEUED",
        "command": "DROP",
        "moduleType": "MILL"
      },
      {
        "id": "2bbd5b43-07f9-4f67-a633-9aae55d55ab6",
        "type": "NAVIGATION",
        "state": "ENQUEUED",
        "source": "MILL",
        "target": "AIQS",
        "dependentActionId": "6aaa9fc6-8e13-4535-b514-23aa71e75e31"
      },
      {
        "id": "33df923c-4022-441d-a9d5-28a259e80dbe",
        "type": "MANUFACTURE",
        "dependentActionId": "2bbd5b43-07f9-4f67-a633-9aae55d55ab6",
        "state": "ENQUEUED",
        "command": "PICK",
        "moduleType": "AIQS"
      },
      {
        "id": "205375e9-ecb6-43b6-a65d-e8a4d9f8df74",
        "type": "MANUFACTURE",
        "dependentActionId": "33df923c-4022-441d-a9d5-28a259e80dbe",
        "state": "ENQUEUED",
        "command": "CHECK_QUALITY",
        "moduleType": "AIQS"
      },
      {
        "id": "0cc7dab1-648b-4276-80b5-f8d1c35c2cde",
        "type": "MANUFACTURE",
        "dependentActionId": "205375e9-ecb6-43b6-a65d-e8a4d9f8df74",
        "state": "ENQUEUED",
        "command": "DROP",
        "moduleType": "AIQS"
      },
      {
        "id": "0eec2bd5-4d93-40fd-bdf8-a0787bd55ce5",
        "type": "NAVIGATION",
        "state": "ENQUEUED",
        "source": "AIQS",
        "target": "DPS",
        "dependentActionId": "0cc7dab1-648b-4276-80b5-f8d1c35c2cde"
      },
      {
        "id": "5882210b-a66d-436b-a649-afb08b6203f3",
        "type": "MANUFACTURE",
        "dependentActionId": "0eec2bd5-4d93-40fd-bdf8-a0787bd55ce5",
        "state": "ENQUEUED",
        "command": "PICK",
        "moduleType": "DPS"
      }
    ],
    "receivedAt": "2025-10-01T10:12:18.691Z",
    "state": "IN_PROGRESS",
    "startedAt": "2025-10-01T10:12:18.692Z"
  }
]